index	word	sentence1	sentence2	start1	start2	end1	end2	label
4081	coverage	There are overlapping coverages on your insurance policies.	The enemy fire is increasing -- can we get some immediate coverage from those bunkers?	58	22	66	31	1
4082	way	They are on the way.	They didn't have much in the way of clothing.	29	16	32	19	0
4083	frequency	The frequency of his seizures increased as he grew older.	The frequency of modulation was 40 cycles per second.	4	4	13	13	1
4084	news	That's news to me.	Is there any news about the storm?	13	7	17	11	1
4085	do	A 'B' grade doesn't suffice to get me into medical school.	What makes her do this way?	15	12	17	16	0
4086	fire	Fire was one of our ancestors' first discoveries.	We sat around the fire singing songs and telling stories.	18	0	22	4	1
4087	fanny	In England 'fanny' is vulgar slang for female genitals.	Her dress was so short you could nearly see her fanny.	48	12	53	17	1
4088	see	I saw their laughing and joking.	You have to be a good observer to see all the details.	34	2	37	5	1
4089	carry	How many credits is this student carrying?	We carry a very large mortgage.	3	33	8	41	1
4090	roll	The water rolled.	I want to get there early; let's roll.	33	10	37	16	0
4091	hit	The ball hit the fence.	We hit Detroit at one in the morning but kept driving through the night.	3	9	6	12	0
4092	hit	The movie hits theaters in December.	The ball hit the fence.	9	10	12	14	0
4093	raise	Raise the specter of unemployment.	To raise somebody to office.	3	0	8	5	0
4094	turn	He turned traitor.	The Earth turns.	10	3	15	9	0
4095	name	He had no sons and there was no one to carry on his name.	Halt in the name of the law.	12	52	16	56	0
4096	connect	Our computers connected together.	The two streets connect to become a highway.	16	14	23	23	0
4097	make	Make the bed.	We should make Cincinnati by 7 tonight.	10	0	14	4	0
4098	blaze	Meteors blazed across the atmosphere.	Blaze a trail.	0	8	5	14	0
4099	pain	That kid is a terrible pain.	Your mother is a right pain.	23	23	27	27	1
4100	thing	He has a thing about seafood.	How could you do such a thing?	24	9	29	14	0
4101	order	It was on the order of a mile.	Magnolias belong to the order Magnoliales.	24	14	29	19	0
4102	draw	They saw that the night was quickly drawing in, so they pitched their tent.	To draw a memorial, a deed, or bill of exchange.	3	36	7	43	0
4103	movement	It was an expensive watch with a diamond movement.	The second movement is slow and melodic.	11	41	19	49	0
4104	pay	He paid off the loan three months early.	Pay attention.	0	3	3	7	0
4105	order	Magnolias belong to the order Magnoliales.	The house is in order.	16	24	21	29	0
4106	absence	Absence makes the heart grow fonder.	He was surprised by the absence of any explanation.	24	0	31	7	1
4107	section	She got a job in the historical section of the Treasury.	A section of a fishing rod.	2	32	9	39	0
4108	back	The wind backed.	The train backed into the station.	10	9	16	15	1
4109	call	The salesman's call on a customer.	He placed a phone call to London.	18	15	22	19	0
4110	scene	He made a scene.	The police returned to the scene of the crime.	27	10	32	15	0
4111	business	Government and business could not agree.	Show me where the business was today.	18	15	26	23	0
4112	execute	Execute the decision of the people.	I'll execute your orders as soon as this meeting is adjourned.	5	0	12	7	1
4113	attack	Hitler attacked Poland on September 1, 1939 and started World War II.	This species of snake will only attack humans if it feels threatened.	32	7	38	15	1
4114	open	Open a business.	Vermont will open elk hunting season next week.	13	0	17	4	1
4115	fiddle	We found out that she had been fiddling for years.	The reporter fiddle with the facts.	13	31	19	39	0
4116	term	A prison term.	He left school before the end of term.	33	9	37	13	1
4117	trouble	He won without any trouble.	I went to a lot of trouble.	19	19	26	26	1
4118	sense	A sense of happiness.	A sense of self.	2	2	7	7	1
4119	progress	He listened for the progress of the troops.	Great progress in the arts.	6	20	14	28	0
4120	funny	She told a funny story.	She made a funny.	11	11	16	16	1
4121	do	Will $100 do?	Do research.	0	10	2	12	0
4122	floor	He is a floor trader.	The floor of the pelvis.	4	8	9	13	0
4123	scrambler	Scramblers can often unnerve a better tennis player.	Their quarterback was a good scrambler.	29	0	38	10	1
4124	apparition	Natives were amazed at the apparition of this white stranger.	The sudden apparition of the Spaniards. -- William H. Prescott.	11	27	21	37	1
4125	believe	After that night in the church, I believed.	When you hear his sermons, you will be able to believe, too.	47	34	54	42	1
4126	lie	The snow lies on the roof.	Lie dormant.	0	9	3	13	0
4127	head	They shot 20 head of quail.	12 head of big cattle and 14 head of branded calves.	3	13	7	17	1
4128	hurl	He managed a hurl of 50.3 metres.	A hurl of abuse.	2	13	6	17	1
4129	opinion	His opinions appeared frequently on the editorial page.	Every man is a fool in some man's opinion.	34	4	41	12	0
4130	use	I can't use this tool.	We only use Spanish at home.	8	8	11	11	1
4131	make	He made to speak but said nothing in the end.	Clothes make the man.	8	3	12	7	0
4132	school	He didn't miss a single day of school.	Stay after school.	11	31	17	37	1
4133	make	Make a move.	Make a decision.	0	0	4	4	1
4134	come	Their anger came to a boil.	Come into contact with a terrorist group.	0	12	4	16	1
4135	turn	Turn towards me.	Turn the flour onto a plate.	0	0	4	4	0
4136	end	The end was exciting.	The end of the year.	4	4	7	7	0
4137	load	He loaded carbs into his system before the marathon.	Load the camera.	0	3	4	9	1
4138	now	There is no better time than now.	It worked up to right now.	22	29	25	32	1
4139	roll	The drawer rolled open.	Roll a cigarette.	0	11	4	17	0
4140	operation	A multinational operation.	The cognitive operation of remembering.	14	16	23	25	0
4141	law	By law, one is not allowed to own a wallaby in New York City.	There is a law against kidnapping.	11	3	14	6	0
4142	house	He has a house on Cape Cod.	The children were playing house.	26	9	31	14	0
4143	spend	I spent the time worrying about the future.	I spend my pocket money in two days.	2	2	7	7	0
4144	encounter	Their encounter was a matter of chance.	There was a brief encounter in the hallway.	18	6	27	15	1
4145	forbid	The rules forbid our smoking.	The rules forbid smoking.	10	10	16	16	1
4146	catch	Catch a glimpse.	Ears open to catch every sound.	13	0	18	5	1
4147	stick	The friends stuck together through the war.	Stick the corner of the sheet under the mattress.	0	12	5	17	0
4148	electrify	Electrify an appliance.	To electrify a limb, or the body.	3	0	12	9	1
4149	call	Why don't you call tomorrow?	Why don't you call me in the morning?	14	14	18	18	1
4150	wash	Can you wash away the spots on the windows?	The car is so dirty, we need to wash it.	32	8	36	12	1
4151	face	I wish I had seen the look on his face when he got the news.	He washed his face.	14	34	18	38	1
4152	come	The first success came three days later.	Come into the room.	0	18	4	22	0
4153	see	Can you see the bird in that tree?	Now I see!	6	8	9	11	0
4154	light	The light of my life.	Magoon's governorship in Cuba was viewed in a negative light by many Cuban historians for years thereafter.	55	4	60	9	1
4155	right	"""Certain rights can never be granted to the government but must be kept in the hands of the people"" -- Eleanor Roosevelt."	She is in the right.	14	9	19	15	0
4156	sign	Those clouds show signs of raining soon.	Those clouds show little sign of raining soon.	25	18	29	23	1
4157	element	In your element.	A component or constituent element of a system.	27	8	34	15	0
4158	ball	A ball of twine.	A ball of fire.	2	2	6	6	1
4159	start	He woke with a start.	He awoke with a start.	16	15	21	20	1
4160	shower	He took a shower after the game.	Her friends organized a baby shower for her when she was expecting.	29	10	35	16	0
4161	set	Set the house afire.	Set these words in italics.	0	0	3	3	0
4162	platoon	Platoons of tourists poured out of the busses.	The defensive platoon of the football team.	14	0	21	8	1
4163	side	Look on the bright side.	He was on the heavy side.	20	19	24	23	1
4164	date	We haven't heard from them to date.	They are up to date.	15	30	19	34	1
4165	raise	Raise a protest.	Raise a sad cry.	0	0	5	5	1
4166	canvas	The crowded canvas of history.	The movie demanded a dramatic canvas of sound.	30	12	36	18	1
4167	fire	We sat around the fire singing songs and telling stories.	There was a fire at the school last night and the whole place burned down.	12	18	16	22	0
4168	lift	I lifted the books onto the table.	Lift the box onto the table.	0	2	4	8	1
4169	set	The set of his mind was obvious.	The set of prime numbers is infinite.	4	4	7	7	0
4170	feel	I felt my way cautiously through the dangerous business maneuver.	I feel that we need to try harder.	2	2	6	6	0
4171	study	No schools offer graduate study in interior design.	He is a quick study.	14	26	19	31	0
4172	mixture	A gradual mixture of cultures.	He drank a mixture of beer and lemonade.	11	10	18	17	0
4173	raise	Raise your hands.	To raise Sandy Hook light.	3	0	8	5	1
4174	read	The fortune teller read his fate in the crystal ball.	She read the sky and predicted rain.	4	19	8	23	1
4175	shower	Today there will be frequent showers and some sunny spells.	Would male strippers be appropriate for the divorce shower?	52	29	58	36	0
4176	throw	He couldn't afford $50 a throw.	Football tickets are expensive at fifty bucks a throw.	48	25	53	30	1
4177	strike	In the fifth inning, the Giants struck, sending three runners home to win the game 5 to 2.	The opponent refused to strike.	24	32	30	38	0
4178	rest	The boulder came to rest just behind the house after rolling down the mountain.	Now that we're all in agreement, we can put that issue to rest.	58	20	62	24	1
4179	connection	My headache has no connection with me going out last night.	The connection between overeating and obesity.	4	19	14	29	1
4180	make	My wife made me buy a new sofa.	Make a mistake.	0	8	4	12	0
4181	expression	Her expression changed from joy to misery after realising her winning lottery ticket had expired.	The best poker players can tell if the opponents have a good hand by looking at their expression.	86	4	96	14	1
4182	run	The book runs 655 pages.	The sale will run for ten days.	14	9	17	13	1
4183	reduce	Reduce one's standard of living.	Reduce a problem to a single question.	0	0	6	6	0
4184	stay	After the trial period, she was asked to stay on and work full-time.	We stayed in Hawaii for a week.	3	41	9	45	0
4185	beat	Beat one's foot rhythmically.	Beat one's breast.	0	0	4	4	1
4186	foot	His bare feet projected from his trousers.	I'll meet you at the foot of the stairs.	21	9	25	13	0
4187	quality	While being impulsive can be great for artists, it is not a desirable quality for engineers.	Membership of this golf club is limited to those of quality and wealth.	52	70	59	77	0
4188	count	There are three apples; count them.	Can you count the books on your shelf?	8	24	13	29	1
4189	stay	We stayed in Hawaii for a week.	Stay alone.	0	3	4	9	1
4190	soul	Soul was politically significant during the Civil Rights movement.	The soul of honor.	4	0	8	4	0
4191	moon	The average distance to the Moon is 384,400 kilometers.	Men first stepped on the moon in 1969.	25	28	29	32	1
4192	detach	His retina detached and he had to be rushed into surgery.	Detach a regiment.	0	11	6	19	0
4193	beam	The fire beamed on their faces.	To beam forth light.	3	9	7	15	1
4194	beat	Agassi beat Becker in the tennis championship.	Thugs beat him up when he walked down the street late at night.	6	7	10	11	0
4195	call	She reported several anonymous calls.	He heard the phone ringing but didn't want to take the call.	55	31	59	36	1
4196	fall	She fell to pieces after she lost her work.	Fall asleep.	0	4	4	8	1
4197	period	Picasso's blue period.	In England they call a period a stop.	23	15	29	21	0
4198	pay	Pay a debt.	Pay an obligation.	0	0	3	3	1
4199	go	Get going!	This violinist is as good as Juilliard-trained violinists go.	58	4	60	9	0
4200	contact	The pilot made contact with the base.	Contact with the pier scraped paint from the hull.	0	15	7	22	0
4201	baby	Hey baby, what are you doing later?	This project is his baby.	20	4	24	8	0
4202	run	He went to Las Vegas and spent all his money over a three-day run.	The assembly line was on a 12-hour run.	35	62	38	65	1
4203	pull	Pull a bank robbery.	You'll be sent home if you pull another stunt like that.	27	0	31	4	1
4204	treatment	A treatment or cure is applied after a medical problem has already started.	The change is due largely to the increased availability of antiretroviral treatment.	74	2	83	11	1
4205	make	He made a fool of himself at the meeting.	Don't make this into a big deal.	6	3	10	7	1
4206	motion	He made a motion to adjourn.	Police controlled the motion of the crowd.	22	10	28	16	0
4207	leave	At her death, she left behind her husband and 11 cats.	Leave your child the nurse's care.	0	18	5	22	0
4208	keep	I keep my specimens under glass to protect them.	Keep food for a week in the pantry.	0	2	4	6	0
4209	air	I need some fresh air.	The flock of birds took to the air.	31	18	34	21	1
4210	vehicle	His editorials provided a vehicle for his political views.	A congregation is a vehicle of group identity.	20	26	27	33	1
4211	block	Block the wheels of a car.	Block a plate for printing.	0	0	5	5	1
4212	dress	Dress the plants in the garden.	Dress the patient.	0	0	5	5	0
4213	stand	There stood on the corner a statue.	Stand the test of time.	0	6	5	11	0
4214	pack	Pack your tents to the top of the mountain.	You had better pack your swollen ankle with ice.	15	0	19	4	0
4215	glimpse	I only got a glimpse of the car, so I can tell you the colour but not the registration number.	From the window he could catch a glimpse of the lake.	33	13	40	20	0
4216	come	I was standing on the corner when Nick came up and asked for a cigarette.	Come into the room.	0	39	4	43	1
4217	normalize	Normalize the spelling.	There is little hope that the two countries will normalize relations; their governments seem to hate each other and would just as soon stay on bad terms.	49	0	58	9	1
4218	beg	He begged her to go to the prom with him.	I beg your pardon. I didn't mean to cause offence.	2	3	5	9	1
4219	separation	He hid in the separation between walls.	The separation of wheat from chaff.	4	14	14	24	0
4220	break	They hoped to avoid a break in relations.	The break in the eighth frame cost him the match.	4	22	9	27	0
4221	order	He put his desk in order.	The machine is now in working order.	30	19	35	24	1
4222	call	The ship will call in Honolulu tomorrow.	To call the roll of a military company.	3	14	7	18	0
4223	negociate	The pianist negociated the difficult runs.	Negociate securities.	0	12	9	22	0
4224	catch	He was caught in the act of stealing a biscuit.	We have a big barrel to catch the rainwater.	24	7	29	13	0
4225	head	The head of the list.	The head of the page.	4	4	8	8	1
4226	anchorage	The mother provides emotional anchorage for the entire family.	The plant needs a firm anchorage.	23	30	32	39	1
4227	turn	The wheels are turning.	Turn on the spot.	0	15	4	22	1
4228	charge	This fellow charges $100 for a massage.	How much do you charge for lunch?	16	12	22	19	1
4229	strike	The boxer struck the attacker dead.	The opponent refused to strike.	24	10	30	16	1
4230	rest	The ocean was finally at rest.	The boulder came to rest just behind the house after rolling down the mountain.	20	25	24	29	1
4231	furniture	How much furniture did they leave behind?	A chair is furniture. Sofas are also furniture.	11	9	20	18	1
4232	feel	She felt small and insignificant.	You make me feel naked.	12	4	16	8	1
4233	voice	Conservatism has many voices.	After the fire a still small voice. -- 1 Kings 19:12.	29	22	34	28	0
4234	position	The position of the hands on the clock.	Chief of Staff is the second highest position in the army.	37	4	45	12	0
4235	blip	You can't react to the day-to-day blips.	Renewed jitters in the wake of a blip in retail sales.	33	34	37	39	1
4236	tell	Tell what happened.	I want to tell a story.	10	0	14	4	1
4237	come	Come with me to the Casbah.	Come down here!	0	0	4	4	1
4238	prove	The exception proves the rule.	Prove a will.	0	14	5	20	0
4239	carry	I carry her image in my mind's eye.	I will carry the secret to my grave.	7	2	12	7	1
4240	be	I shall be writing to you soon.	When will the meeting be?	22	8	24	10	1
4241	reproduction	Gutenberg's reproduction of holy texts was far more efficient.	Unauthorized reproduction of this article is prohibited.	13	12	25	24	1
4242	third	He ate a third of the pie.	It contains approximately a third of the minimum daily requirement.	28	9	33	14	0
4243	check	Check the oil in your car once a month.	Katie's sick, so I need to check up on her and see if she needs anything.	27	0	32	5	1
4244	vermin	Cereals must be protected from mice and other vermin.	Boys in the village have probably been shooting vermin.	48	46	54	52	1
4245	product	Skill is the product of hours of practice.	This is a product of lime and nitric acid.	10	13	17	20	0
4246	lock	The parents locked her daughter up for the weekend.	The therapist noticed that the patient's knees tended to lock in this exercise.	57	12	61	18	0
4247	audience	He saw that he had lost his audience.	Every artist needs an audience.	22	28	30	36	0
4248	break	The dam broke.	Break an alibi.	0	8	5	13	0
4249	head	He is two heads taller than his little sister.	A head of cauliflower.	2	10	6	15	0
4250	point	The one with the most points will win the game.	To fall off a point.	14	22	19	28	0
4251	remember	I can't remember saying any such thing.	Do you remember that he once loved you?	7	8	15	16	1
4252	reason	There is reason to believe he is lying.	The reason that war was declared.	4	9	10	15	0
4253	number	This sweater is an all-wool number.	I hope to become one of their number before I die.	30	28	36	34	0
4254	life	His heroism saved a life.	Get a life.	6	20	10	24	0
4255	sense	He hasn't got the sense God gave little green apples.	It's common sense not to put metal objects in a microwave oven.	12	18	17	23	1
4256	raise	Raise a siege.	To raise a wall, or a heap of stones.	3	0	8	5	0
4257	remain	There remains the question of who pulled the trigger.	There was no food in the house, so I had to remain hungry.	44	6	50	13	0
4258	be	The sky is blue.	I shall be writing to you soon.	8	8	10	10	1
4259	ball	The ball rolled into the corner pocket.	The mayor threw out the first ball.	30	4	34	8	1
4260	hum	The hum of distant traffic.	There is a constant hum of military preparation.	20	4	23	7	0
4261	border	There's a nice frilly border around the picture frame.	A solid border around a table of figures.	8	22	14	28	1
4262	make	What make of car do you drive?	What make of car is that?	5	5	9	9	1
4263	break	He was up two breaks in the second set.	There was a break in the action when a player was hurt.	12	14	17	20	0
4264	body	They found the body in the lake.	What's a body got ta do to get a drink around here?	9	15	13	19	1
4265	keep	I always keep batteries in the freezer.	Keep food for a week in the pantry.	0	9	4	13	1
4266	seat	He sat on the arm of the chair rather than the seat, which always annoyed his mother.	The seat of a saddle.	4	47	8	51	1
4267	set	His instructions deliberately gave them the wrong set.	The subjects' set led them to solve problems the familiar way and to overlook the simpler solution.	14	50	17	53	1
4268	squeeze	Getting through that small opening was a tight squeeze.	Increased expenses put a squeeze on profits.	25	47	32	54	0
4269	krona	Kronas kurss -- the exchange rate of the krona.	Piecas kronas -- five krona.	22	41	27	46	1
4270	place	A woman's place is no longer in the kitchen.	Your place or mine?	5	10	10	15	0
4271	key	The key to solving this problem is persistence.	The key to winning a game.	4	4	7	7	1
4272	ride	She rode a wave of popularity.	I ride to work in a bus.	2	4	6	8	0
4273	teach	Wanda taught the students.	Can you teach me to sew?	8	6	13	12	1
4274	home	There's no place like home.	Home is where the heart is.	0	22	4	26	1
4275	cuddle	I cuddled the baby.	I'm cold; can you roll over here and cuddle me, honey?	37	2	43	9	1
4276	pull	Pull weeds.	Pull a horse.	0	0	4	4	0
4277	arousal	The animal undergoes regular spells of arousal.	The mechanism for arousal from sleep.	18	39	25	46	1
4278	lumberyard	He got a job at the lumberyard, working the big saw for planks.	I'll just go to the lumberyard and buy some more two by fours so we can finish building this.	20	20	30	30	1
4279	practice	Pianists practice scales.	You should practice playing piano every day.	11	9	19	17	1
4280	repair	He repaired to his cabin in the woods.	One can never fully repair the suffering and losses of the Jews in the Third Reich.	20	3	26	11	0
4281	hit	The temperature could hit 110 F tomorrow.	We were hit by really bad weather.	8	22	11	25	0
4282	militate	Politeness militated against this opinion being expressed.	To militate in favor of a particular result.	3	11	11	20	1
4283	beat	Beat the subway fare.	I beat the traffic.	2	0	6	4	0
4284	go	We should go farther in this matter.	Messages must go through diplomatic channels.	14	10	16	12	1
4285	copy	Please bring me the copies of those reports.	She made a copy of the designer dress.	11	20	15	26	1
4286	know	She knew of our plan.	I know it's time.	2	4	6	8	1
4287	cycle	The cycle of the seasons, or of the year.	The never-ending cycle of the seasons.	17	4	22	9	1
4288	catch	She really caught the spirit of the place in her drawings.	If you leave now you might catch him.	27	11	32	17	0
4289	shoot	In my round of golf yesterday I shot a 76.	Shoot a goal.	0	32	5	36	1
4290	neighborhood	The price is in the neighborhood of $100.	My neighborhood voted for Bush.	3	20	15	32	0
4291	cost	The cost in human life was enormous.	The average cost of a new house is twice as much as t was 20 years ago.	12	4	16	8	0
4292	keep	Keep a diary.	Keep notes.	0	0	4	4	1
4293	part	Glue the two parts together.	They resisted every effort on his part.	34	13	38	18	0
4294	reduce	The cells reduce.	Reduce a problem to a single question.	0	10	6	16	0
4295	start	I start my day with a good breakfast.	I start at eight in the morning.	2	2	7	7	0
4296	set	Set these words in italics.	To set pear trees in an orchard.	3	0	6	3	0
4297	house	She felt she had to get out of the house.	This is my house and my family's ancestral home.	11	35	16	40	1
4298	touch	This room needs a woman's touch.	He longed for the touch of her hand.	18	26	23	31	0
4299	return	The return of spring.	A return to one's question.	2	4	8	10	0
4300	bag	He carried his small bag onto the plane with him.	He ate a large bag of popcorn.	15	21	18	24	0
4301	admit	She admitted us here.	We can not admit non-members into our club building.	11	4	16	12	1
4302	take	Be taken drunk.	Take sick.	0	3	4	8	1
4303	circulation	Ocean circulation is an important part of global climate.	A fan aids air circulation.	15	6	26	17	1
4304	pop	The man charged with murder popped a valium to calm his nerves.	Pop the pizza into the microwave oven.	0	28	3	34	0
4305	shell	Wheat or rye shells in reaping.	Nuts shell in falling.	5	13	10	19	1
4306	melt	The wax melted in the sun.	Melt butter.	0	8	4	14	1
4307	monopoly	When you have a monopoly you can ask any price you like.	A monopoly on silver.	2	16	10	24	1
4308	fall	His voice fell to a whisper.	The hills around here fall towards the ocean.	22	10	26	14	0
4309	sound	Owen Sound.	The sound awakened them.	4	5	9	10	0
4310	receive	The community warmly received the refugees.	Receive the incoming radio signals.	0	21	7	29	0
4311	pocket	They dipped into the taxpayers' pockets.	The trapped miners found a pocket of air.	27	32	33	39	0
4312	land	There's no work on the land any more.	He built the house on land leased from the city.	22	23	26	27	0
4313	draw	Draw a deep breath.	Draw on a cigarette.	0	0	4	4	1
4314	militate	To militate in favor of a particular result.	To militate against the possibility of his election.	3	3	11	11	1
4315	operation	They had to consolidate their operations.	They paid taxes on every stage of the operation.	38	30	47	40	1
4316	head	A head of lettuce.	A head of cauliflower.	2	2	6	6	1
4317	head	Be careful when you pet that dog on the head; it may bite.	He stuck his head out the window.	13	40	17	44	1
4318	match	Matchmaker, can you match my daughter with a nice young man?	Their interests didn't match, so it took a long time to agree what to do together.	23	20	28	25	0
4319	neighbour	They're our neighbours across the street.	My neighbour has an annoying cat.	3	12	12	22	1
4320	office	He rented an office in the new building.	An executive or judical office.	24	13	30	19	0
4321	die	She died from cancer.	To die to pleasure or to sin.	3	4	6	8	1
4322	set	A set of teeth.	A set of golf clubs.	2	2	5	5	1
4323	point	A row of points.	Cut the skin with the point of the knife.	22	9	27	15	0
4324	stretch	By no stretch of the imagination.	Running at full stretch.	16	6	23	13	1
4325	hold	The weather held.	To hold true.	3	12	7	16	1
4326	speak	Although I don't speak Chinese I managed to talk with the villagers using signs and gestures.	They speak a strange dialect.	5	17	10	22	1
4327	get	Get permission to take a few days off from work.	She didn't get to Chicago until after midnight.	11	0	14	3	0
4328	floor	The floor of a cave served the refugees as a home.	The floor of the cave.	4	4	9	9	1
4329	change	Can I get change for this $100 bill please?	He got change for a twenty and used it to pay the taxi driver.	7	10	13	16	1
4330	voice	The incessant voices of the artillery.	The noisy voice of the waterfall.	10	14	15	20	1
4331	sense	A sense of security.	A sense of danger.	2	2	7	7	1
4332	point	Point the letter.	Point a chimney.	0	0	5	5	0
4333	show	His good upbringing really shows.	The dirty side will show.	20	27	24	32	1
4334	light	They played as long as it was light.	He stepped into the light.	20	30	25	35	0
4335	life	While there's life there's hope.	He appointed himself emperor for life.	33	14	37	18	0
4336	commission	A reseller's commission.	He works on commission.	12	13	22	23	1
