index	word	sentence1	sentence2	start1	start2	end1	end2	label
1282	sense	It's common sense not to put metal objects in a microwave oven.	Fortunately she had the good sense to run away.	29	12	34	17	1
1283	quality	One of the qualities of pure iron is that it does not rust easily.	While being impulsive can be great for artists, it is not a desirable quality for engineers.	70	11	77	20	1
1284	drink	He jumped into the drink and had to be rescued.	Can I buy you a drink?	16	19	21	24	0
1285	vicinity	There is a hurricane in the vicinity of the Bahamas.	The plane crashed in the vicinity of Asheville.	25	28	33	36	1
1286	play	Play cards.	Play football.	0	0	4	4	1
1287	ground	The storm grounded the ship.	Ground the electrical connections for safety reasons.	0	10	6	18	0
1288	disturbance	There was a disturbance of neural function.	He looked around for the source of the disturbance.	39	12	50	23	1
1289	dress	Dress the plants in the garden.	She likes to dress when going to the opera.	13	0	18	5	0
1290	cry	He cried his merchandise in the market square.	Before we had newspapers, a town crier would cry the news.	45	3	48	8	1
1291	dwelling	I was doing dwelling in the cave.	The old house served as a dwelling for Albert.	26	12	34	20	1
1292	fire	Fire was one of our ancestors' first discoveries.	Put the kettle on the fire.	22	0	26	4	0
1293	life	She's my love, my life.	I have known him all his life.	25	18	29	22	0
1294	remember	I remember the concert clearly, but I can't recollect why I was there.	Can you remember her phone number?	8	2	16	10	1
1295	connection	He has powerful connections.	There was a connection via the internet.	12	16	22	27	0
1296	know	I want to know who is winning the game!	It is vital that he not know.	24	10	28	14	1
1297	drill	Drill for oil.	Drill a hole into the wall.	0	0	5	5	1
1298	purchase	To purchase land, to purchase a house.	$50 won't even purchase a dress.	15	3	23	11	1
1299	source	He spent hours looking for the source of that quotation.	Pittsburgh is the source of the Ohio River.	18	31	24	37	0
1300	day	I've been here for 2 days and a bit.	It should arrive any day now.	21	21	24	25	1
1301	sex	All you ever think about is sex.	We had sex in the back seat.	7	28	10	31	1
1302	leave	His good luck finally left him.	She wants to leave.	13	22	18	26	0
1303	drive	We drive the turnpike to work.	You drive nails into wood with a hammer.	4	3	9	8	0
1304	develop	Spassky developed quickly.	Could you develop the ideas in your thesis.	10	8	17	17	0
1305	history	A critical time in the school's history.	A history of France.	2	32	9	39	0
1306	floor	The pit floor showed where a ring of post holes had been.	The floor of the cave.	4	8	9	13	1
1307	interest	In the common interest.	In the interest of safety.	7	14	15	22	1
1308	model	A model of clarity.	The computer weather model did not correctly predict the path of the hurricane.	21	2	26	7	0
1309	court	The house was built around an inner court.	The queen and her court traveled to the city to welcome back the soldiers.	18	36	23	41	0
1310	development	Such land is practical for small park developments.	The development of Alaskan resources.	4	38	15	50	0
1311	come	The shoes came untied.	Come into contact with a terrorist group.	0	10	4	14	1
1312	space	Functional analysis is best approached through a sound knowledge of Hilbert space theory.	They tested his ability to locate objects in space.	45	76	50	81	1
1313	dress	Can the child dress by herself?	We had to dress quickly.	10	14	15	19	1
1314	movement	Movement is a sign of life.	Politicians have to respect a mass movement.	35	0	43	8	0
1315	land	They come from a faraway land.	An industrialized land.	18	25	22	29	0
1316	stuff	The trunk was full of stuff.	You don't have the stuff to be a United States Marine.	19	22	24	27	0
1317	follow	Follow the trail.	Follow the road.	0	0	6	6	1
1318	execute	Your orders have been executed, sir!	Execute the decision of the people.	0	22	7	30	1
1319	lift	Lift his ego.	Lift my spirits.	0	0	4	4	1
1320	history	The dawn of recorded history.	All of human history.	13	21	20	28	0
1321	machinery	The machinery of command labored and brought forth an order.	The complex machinery of negotiation.	12	4	21	13	1
1322	serve	The entertainers served up a lively show.	We serve meals for the homeless.	3	17	8	23	1
1323	strike	The Germans struck Poland on Sept. 1, 1939.	We must strike the enemy's oil fields.	8	12	14	18	1
1324	start	The rain started at 9:00.	I start at eight in the morning.	2	9	7	16	0
1325	strike	A hammer strikes against the bell of a clock.	We must strike the enemy's oil fields.	8	9	14	16	0
1326	lightning	The lightning was hot enough to melt the sand.	That tree was hit by lightning.	21	4	30	13	1
1327	turn	The alchemists tried to turn lead into gold.	Turn your dance partner around.	0	24	4	28	0
1328	figure	A heroic figure.	He cut a sorry figure standing there in the rain.	15	9	21	15	1
1329	tension	Tension holds the belt in the pulleys.	He suffered from fatigue and emotional tension.	39	0	46	7	0
1330	sense	Common sense is not so common.	It's common sense not to put metal objects in a microwave oven.	12	7	17	12	1
1331	carry	The dog was taught to fetch and carry.	These bonds carry warrants.	12	32	17	37	0
1332	poison	The poison of fascism.	Gossip is a malicious poison.	22	4	28	10	1
1333	course	She prepared a three course meal.	He took a course in basket weaving.	10	21	16	27	0
1334	cut	Cut a nice figure.	Cut paper dolls.	0	0	3	3	0
1335	hearing	My hearing isn't what it used to be, but I still heard that noise.	His hearing was impaired.	4	3	11	10	1
1336	arouse	To arouse compassion.	Arouse pity.	0	3	6	9	1
1337	stretch	I stretched the rubber band until it almost broke.	Cats stretch with equal ease and agility beyond the point that breaks a man on the rack.	5	2	12	11	0
1338	come	Come into the room.	The sleeves come to your knuckles.	12	0	16	4	0
1339	match	Match my sweater.	These two copies are supposed to be identical, but they don't match.	62	0	67	5	0
1340	post	A pair of posts marked the goal.	He occupied a post in the treasury.	14	10	18	15	0
1341	coverage	The dictionary's coverage of standard English is excellent.	Before laying sod on that clay, the ground needs two inches of coverage with topsoil.	63	17	71	25	1
1342	catch	If he catches you on the chin, you'll be on the mat.	Did you catch a cold?	8	6	13	13	0
1343	make	Make advances.	Make a move.	0	0	4	4	1
1344	appear	She appeared on several charges of theft.	He had to appear in court last month.	10	4	16	12	1
1345	bake	I baked a delicious cherry pie.	Potatoes bake to a crisp.	9	2	13	7	1
1346	pay	You'll pay for this!	Pay a call.	0	7	3	10	0
1347	top	He stared as she buttoned her top.	Only the top side of the box was painted.	9	30	12	33	0
1348	fall	They fell out of favor.	Fall prey to an imposter.	0	5	4	9	1
1349	song	The song of the wind.	The song of bullets was in the air.	4	4	8	8	1
1350	line	I tried to make a call, but the line was dead.	Please speak up, the line is very faint.	21	32	25	36	1
1351	plan	They discussed plans for a new bond issue.	They drew up a six-step plan.	24	15	28	20	1
1352	permit	This permits the water to rush in.	This will permit the rain to run off.	10	5	16	12	1
1353	volume	The volume of exports.	The volume of ticket sales decreased this week.	4	4	10	10	0
1354	reaction	A bad reaction to the medicine.	You were in the courtroom. What is your reaction?	40	6	48	14	1
1355	help	I can't help myself -- I have to smoke.	She could not help watching the sad spectacle.	14	8	18	12	1
1356	apology	What he said really hurt my feelings, but his apology sounded so sincere that I couldn't help but forgive him.	The CEO made a public apology for the scandal, and promised full cooperation with the authorities.	22	46	29	53	1
1357	take	The escaped convict took to the hills.	Take an opportunity.	0	20	4	24	0
1358	call	The salesman's call on a customer.	After two raises there was a call.	29	15	33	19	0
1359	keep	Keep your temper.	Keep your cool.	0	0	4	4	1
1360	mount	The rider mounted his horse.	Mount a horse.	0	10	5	17	1
1361	check	They made a check of their equipment.	Put a check mark in the box corresponding to the correct answer.	6	12	11	17	0
1362	picture	The political picture is favorable.	The very picture of a modern general.	9	14	16	21	0
1363	wash	Can you wash away the spots on the windows?	He managed to wash out the stains.	14	8	18	12	1
1364	tolerate	I can tolerate working on Saturdays, but not on Sundays.	I like the way he plays the guitar, but I can't tolerate his voice when he sings.	48	6	56	14	1
1365	mean	I'm afraid I don't understand what you mean.	I didn't mean to knock your tooth out.	9	39	13	43	0
1366	hold	She can hold an audience spellbound.	I hold with those who say life is sacred.	2	8	6	12	0
1367	conflict	I wanted to attend the meeting but there's a conflict in my schedule that day.	The conflict between the government and the rebels began three years ago.	4	45	12	53	0
1368	patch	A briar patch.	A cabbage patch.	10	8	15	13	1
1369	leave	I left my keys inside the car and locked the doors.	Leave it as is.	0	2	5	6	0
1370	hold	He's held by a contract.	To hold true.	3	5	7	9	0
1371	song	I love hearing the song of canary birds.	A bird will not learn its song unless it hears it at an early age.	26	19	30	23	1
1372	render	Render fat in a casserole.	Render thanks.	0	0	6	6	0
1373	concern	She felt strong concern for those less fortunate.	The safety of the ship is the captain's concern.	40	16	47	23	0
1374	orbit	The planets are orbiting the sun.	Electrons orbit the nucleus.	10	16	15	24	1
1375	dibs	Dibs means I get the hammock.	Who's got dibs on the chips?	10	0	14	4	1
1376	carry	Sound carries well over water.	The airwaves carry the sound.	13	6	18	13	1
1377	pain	That kid is a terrible pain.	The patient developed severe pain and distension.	29	23	33	27	0
1378	make	Make a mistake.	What do you make of his remarks?	12	0	16	4	0
1379	credit	Give her credit for trying.	He was given credit for his work.	13	9	19	15	1
1380	case	A window case.	It may rain in which case the picnic will be canceled.	21	9	25	13	0
1381	set	The set of prime numbers is infinite.	He gave a final set to his hat.	16	4	19	7	0
1382	night	They worked from morning to night.	From noon till night.	15	28	20	33	1
1383	rub	Rub oil into her skin.	Rub my hands.	0	0	3	3	1
1384	field	The farmer's field was a civil war battleground, and relics such a minnie bullets were frequently found while plowing.	He was an expert in the field of Chinese history.	24	13	29	18	0
1385	hold	Hold all calls to the President's office while he is in a meeting.	I hold with those who say life is sacred.	2	0	6	4	0
1386	burn	Witches were burned in Salem.	Burn a CD.	0	13	4	19	0
1387	life	I have known him all his life.	While there's life there's hope.	14	25	18	29	0
1388	turn	She is turning 50 this year.	Turn your face to the wall.	0	7	4	14	0
1389	admit	He admitted his guilt.	We'll have to vote on whether or not to admit a new member.	40	3	45	11	0
1390	set	The sets were meticulously authentic.	His instructions deliberately gave them the wrong set.	50	4	53	8	0
1391	top	I bought this top as it matches my jeans.	He stared as she buttoned her top.	30	14	33	17	1
1392	hand	He kept trying to see my hand.	I didn't hold a good hand all evening.	21	25	25	29	1
1393	education	A good teacher is essential for a good education.	He received no formal education.	22	39	31	48	1
1394	leave	Might I beg leave to accompany you?	A ten day's leave to visit his mother.	12	12	17	17	0
1395	play	She plays on her clients' emotions.	Play with her feelings.	0	4	4	9	0
1396	presence	Any painter can benefit from the presence of a live model from which to draw.	He sensed the presence of danger.	14	33	22	41	0
1397	see	I saw her bake the cake.	Can you see the bird in that tree?	8	2	11	5	1
1398	beat	Reading beats watching television.	Beat the egg whites.	0	8	4	13	0
1399	masquerade	That masquerade of misrepresentation which invariably accompanied the political eloquence of Rome -- Thomas de Quincey.	I was invited to the masquerade at their home.	21	5	31	15	1
1400	raise	Raise hell.	To raise Sandy Hook light.	3	0	8	5	0
1401	think	I thought for three hours about the problem and still couldn't find the solution.	She didn't think to harm me.	11	2	16	9	1
1402	go	The day went well until I got your call.	These ugly billboards have to go!	30	8	32	12	0
1403	work	Can you work an electric drill?	I can not work a miracle.	10	8	14	12	0
1404	break	Break a law.	Break a promise.	0	0	5	5	1
1405	etiolation	The etiolation of celery.	His etiolation signaled years in prison.	4	4	14	14	0
1406	chain	The third link of the silver chain needs to be resoldered.	A chain of ideas, one leading to the next.	2	29	7	34	1
1407	air	I need some fresh air.	If you've time to spare go by air.	30	18	33	21	0
1408	fun	He was fun to be with.	They began to fight like fun.	25	7	28	10	0
1409	break	News of her death broke in the morning.	The newsman wanted to break a big story, something that would make him famous.	22	18	27	23	1
1410	allow	To allow a servant his liberty.	This sealed door won't allow the water come into the basement.	23	3	28	8	0
1411	make	Make water into wine.	Make clay into bricks.	0	0	4	4	1
1412	follow	Follow the trail.	When he lectures, I can not follow.	28	0	34	6	0
1413	credit	I give you credit for owning up to your mistake.	He was given credit for his work.	13	11	19	17	1
1414	click	Click! The door opened.	Xhosa speakers click.	15	0	20	5	0
1415	cover	Cover the child with a blanket.	Cover her face with a handkerchief.	0	0	5	5	1
1416	see	I can see a risk in this strategy.	I can see what will happen.	6	6	9	9	1
1417	operation	That rule is no longer in operation.	The cognitive operation of remembering.	14	26	23	35	0
1418	foot	His bare feet projected from his trousers.	The foot of the mountain.	4	9	8	13	0
1419	draw	Draw a line.	Draw steel.	0	0	4	4	0
1420	avoid	He avoided going to the area.	Her former friends now avoid her.	23	3	28	10	1
1421	go	This door goes to the basement.	How fast does your new car go?	27	10	29	14	0
1422	emission	The emission was mostly blood.	The emission of heat from a fire.	4	4	12	12	0
1423	come	The bill came to $2,000.	Your wish will come true.	15	9	19	13	0
1424	lift	Lift a load.	You never lift a finger to help me!	10	0	14	4	1
1425	furniture	There was only one piece of furniture in the room.	They had too much furniture for the small apartment.	18	28	27	37	1
1426	offer	He offered his opinion.	Offer prayers to the gods.	0	3	5	10	0
1427	change	The product is undergoing a change in order to improve it.	She brought a change in her overnight bag.	14	28	20	34	0
1428	control	Control an account.	Control the budget.	0	0	7	7	0
1429	give	The French doors give onto a terrace.	Give priority to.	0	17	4	21	0
1430	draw	Draw parallels.	Draw water for a bath.	0	0	4	4	0
1431	ground	The worm crawls through the ground.	They fought to regain the lost ground.	31	28	37	34	0
1432	catch	If he catches you on the chin, you'll be on the mat.	Ears open to catch every sound.	13	6	18	13	0
1433	carry	Amanda carried the package from home to New York.	You must carry your camping gear.	9	7	14	14	1
1434	motion	He made a motion to adjourn.	The reflex motion of his eyebrows revealed his surprise.	11	10	17	16	0
1435	year	She is 4 years old.	A normal year has 365 full days, but there are 366 days in a leap year.	9	9	13	14	1
1436	burn	The iron burnt a hole in my dress.	To burn the mouth with pepper.	3	9	7	14	1
1437	fall	Her hair fell across her forehead.	Fall prey to an imposter.	0	9	4	13	0
1438	find	Find the product of two numbers.	These aspects of civilization do not find expression or receive an interpretation.	37	0	41	4	0
1439	stay	The judge stayed the execution order.	Stay alone.	0	10	4	16	0
1440	play	Who's playing now?	Play the stock market.	0	6	4	13	0
1441	variant	"All breeds of dog are variants of the species ""Canis lupus familiaris""."	"The word ""kerosine"" is a variant of ""kerosene""."	25	22	32	30	1
1442	stuff	You don't have the stuff to be a United States Marine.	The stuff of heros.	4	19	9	24	1
1443	day	It was a busy day on the stock exchange.	My day began early this morning.	3	14	6	17	1
1444	carry	These pipes carry waste water into the river.	Carry the suitcases to the car.	0	12	5	17	1
1445	drill	Don't drill here, there's a gas pipe.	Drill for oil.	0	6	5	11	1
1446	blend	He blends in with the crowd.	Blend the nuts and raisins together.	0	3	5	9	1
1447	present	He lives in the present with no thought of tomorrow.	That is enough for the present.	23	16	30	23	1
1448	work	My wife never worked.	This dough does not work easily.	20	14	24	20	0
1449	fall	She fell ill.	Fall into a trap.	0	4	4	8	1
1450	relationship	The relationship between mothers and their children.	He didn't want his wife to know of the relationship.	39	4	51	16	0
1451	back	I hung the clothes on the back of the door.	He wrote the date on the back of the photograph.	25	26	29	30	1
1452	fire	Hold your fire until you can see the whites of their eyes.	He went through fire and damnation.	16	10	20	14	0
1453	part	We all have a part to play.	She played the part of Desdemona.	15	14	19	18	1
1454	block	He blocked the basketball player's shot.	Block an attack.	0	3	5	10	1
1455	foulness	Mouths which speak such foulness must be cleansed.	His display of foulness deserved severe punishment.	15	24	23	32	1
1456	voice	The incessant voices of the artillery.	The wee small voice of conscience.	14	14	19	20	0
1457	utility	The price of the house included all utilities.	A computer system provides utility programs to perform the tasks needed by most users.	27	36	34	45	0
1458	wave	She waved her gun.	She asked the hairdresser to wave her hair.	29	4	33	9	0
1459	run	Our coach had us running plays for the whole practice.	I will run the sample.	7	17	10	24	1
1460	raise	Raise the question of promotions.	We raise hogs here.	3	0	8	5	0
1461	difference	There were irreconcilable differences.	It just won't make much difference to me.	24	26	34	37	0
1462	head	They tracked him back toward the head of the stream.	She gave great head.	15	33	19	37	0
1463	antagonist	When bending the elbow the triceps are the antagonist.	A flexor, which bends a part, is the antagonist of an extensor, which extends it.	37	43	47	53	1
1464	volume	The kids played their music at full volume.	Please turn down the volume on the stereo.	21	36	27	42	1
1465	try	This approach has been tried with good results.	If you want to play varsity, you'll have to try out for the team.	44	23	47	28	1
1466	snap	Bullets snapped past us.	To snap a whip.	3	8	7	15	0
1467	get	You can not get water out of a stone.	Where did she get these news?	14	12	17	15	1
1468	check	He asked the waiter for the check.	He paid all his bills by check.	25	28	30	33	0
1469	see	I went to see my friend Mary the other day.	The artist must first learn to see.	31	10	34	13	0
1470	draw	He drew an elaborate plan of attack.	Draw parallels.	0	3	4	7	0
1471	trend	Not openly liberal but that is the trend of the book.	The upward trend of stock-market prices.	11	35	16	40	0
1472	head	The head of the hammer.	Under the head of minor Roman poets.	10	4	14	8	0
1473	keep	Keep my seat, please.	Keep open the possibility of a merger.	0	0	4	4	1
1474	read	I read this address as a satire.	She read my mind and promptly rose to get me a glass of water.	4	2	8	6	1
1475	face	She wanted to wipe him off the face of the earth.	Dew dripped from the face of the leaf.	21	31	25	35	1
1476	raise	Raise a sad cry.	Raise my salary.	0	0	5	5	0
1477	point	The dog pointed the dead duck.	If he asks for food, point him toward the refrigerator.	21	8	26	15	0
1478	work	He works his parents for sympathy.	Do you want to work after the age of 60?	15	3	19	8	0
1479	beat	Beat the subway fare.	The boat beat in the strong wind.	9	0	13	4	0
1480	depth	From the depths of darkest Africa.	The depth of the water.	4	9	9	15	0
1481	unit	A unit of wheat is a bushel.	The team is a unit.	14	2	18	6	0
1482	cut	Cut paper dolls.	Cut a Ping-Pong ball.	0	0	3	3	0
1483	spray	Spray water on someone.	Spray paint on the wall.	0	0	5	5	1
1484	air	A smell of chemicals in the air.	He threw the ball into the air.	27	28	30	31	0
1485	admit	To admit a serious thought into the mind.	We can not admit non-members into our club building.	11	3	16	8	1
1486	come	Next came the student from France.	Your wish will come true.	15	5	19	9	0
1487	belong	The uniform looks like it belonged to a museum collection.	These pages don't belong.	18	26	24	34	1
1488	field	Field of view.	The set of rational numbers, \mathbbQ, is the prototypical field.	59	0	64	5	0
1489	bull	What he said was mostly bull.	He was a bull of a man.	9	24	13	28	0
1490	drive	Drive the forest.	To drive sheep out of a field.	3	0	8	5	0
1491	theater	He served in the Vietnam theater for three years.	His grandfather was in the Pacific theater during the war.	35	25	42	32	1
1492	sophisticate	Their manners had sophisticated the young girls.	Yet Butler professes to stick to plain facts, not to sophisticate, not to refine. -- M. Arnold.	53	18	65	31	0
1493	area	The photo is a little dark in that area.	It was about 500 square feet in area.	32	35	36	39	1
1494	spin	He took the new car for a spin.	One of the planet's moons has a slower spin than the others.	39	26	43	30	0
1495	interrupt	We interrupt the program for the following messages.	Don't interrupt me when I'm reading.	6	3	15	12	0
1496	cut	This cuts into my earnings.	Cut a disk.	0	5	3	9	0
1497	piece	He wrote an interesting piece on Iran.	He sacrificed a piece to get a strategic advantage.	16	24	21	29	0
1498	action	The Union action of emancipating Southern slaves.	A rifle action.	8	10	14	16	0
1499	origin	The rumor had its origin in idle gossip.	Origin in sensation.	0	18	6	24	1
1500	place	Your place or mine?	He has a special place in my thoughts.	17	5	22	10	0
1501	drift	The stock market drifted upward.	Don't drift from the set course.	6	17	11	24	0
1502	see	I'll probably see you at the meeting.	How nice to see you again!	12	14	15	17	1
1503	raise	The President raised several million dollars for his college.	Raise a siege.	0	14	5	20	0
1504	catch	Catch the mood.	We have a big barrel to catch the rainwater.	24	0	29	5	0
1505	part	His part was right in the middle.	The part of his hair was slightly to the left.	4	4	8	8	1
1506	window	The expanded window will give us time to catch the thieves.	Window of opportunity.	0	13	6	19	1
1507	stock	She made gravy with a base of beef stock.	The rifle had been fitted with a special stock.	41	35	46	40	0
1508	finish	Excitement grew as the finish neared.	His best finish in a major tournament was third.	9	23	15	29	0
1509	worry	His worry over the prospect of being fired.	It is not work but worry that kills.	19	4	24	9	1
1510	case	A case of the jitters.	The accusative case canonically indicates a direct object.	15	2	19	6	0
1511	loosen	After the Thanksgiving meal, Bill loosened his belt.	To loosen a knot.	3	34	9	42	1
1512	cut	She cut all of her major titles again.	Cut the songs.	0	4	3	7	1
1513	flatten	Flatten a road.	Flatten your stomach with these exercises.	0	0	7	7	1
1514	rain	The rains came late that year.	We've been having a lot of rain lately.	27	4	31	9	1
1515	normalize	Normalize the spelling.	Normalize relations with China.	0	0	9	9	1
1516	see	We had to see a psychiatrist.	What message do you see in this letter?	20	10	23	13	0
1517	say	Please say your name slowly and clearly.	I can not say 'zip wire'.	10	7	13	10	1
1518	change	Can I get change for this $100 bill please?	He attributed the change to their marriage.	18	10	24	16	0
1519	draw	She drew $2,000 from the account.	Draw a conclusion.	0	4	4	8	0
1520	rap	It was a bum rap.	You can't act irresponsibly and then expect me to take the rap.	59	13	62	16	1
1521	side	John wrote 15 sides for his essay!	It brought out his better side.	26	14	30	19	0
1522	winnow	Winnow the finalists from the long list of applicants.	Winnow chaff.	0	0	6	6	0
1523	business	Business is good today.	They did nearly a million dollars of business over the long weekend.	37	0	45	8	1
1524	refill	He got a refill for his ball-point pen.	He got a refill for his notebook.	9	9	15	15	1
1525	hold	Hold these truths to be self-evident.	Hold in place.	0	0	4	4	0
1526	run	She ran her fingers along the carved figurine.	The crowd had to run away from the burning structure with only the clothes on their backs.	17	4	20	7	0
1527	presence	He tested for the presence of radon.	He sensed the presence of danger.	14	18	22	26	0
1528	render	They had to render the estate.	Render fat in a casserole.	0	12	6	18	0
1529	mouth	The jar had a wide mouth.	New York is at the mouth of the Hudson.	19	19	24	24	0
1530	mean	I mean to go to Baddeck this summer.	You never understand what I mean!	28	2	32	6	0
1531	production	They hope to increase spaghetti production next year.	The production of white blood cells.	4	32	14	42	0
1532	loss	Weight loss.	A serious loss of business.	10	7	14	11	1
1533	stuff	The stuff of heros.	There's good stuff in that book.	13	4	18	9	0
1534	academy	The American Academy of Arts and Sciences.	The military academy at West Point.	13	13	20	20	0
1535	head	At five years of age this head of cattle is worth perhaps $40.	12 head of big cattle and 14 head of branded calves.	3	26	7	30	1
1536	give	What gives?	Give one's talents to a good cause.	0	5	4	10	0
1537	have	Have a lover.	The only girl who would have him was the miller's daughter.	24	0	28	4	0
1538	touch	Are you all right? You've hardly touched your lunch.	She didn't touch her food all night.	11	33	16	40	1
1539	arouse	To arouse compassion.	To arouse jealousy.	3	3	9	9	1
1540	credit	Give her credit for trying.	He arrived five minutes late, but to his credit he did work an extra ten minutes at the end of his shift.	41	9	47	15	1
1541	ball	The ball travelled 90 mph on his serve.	The ball rolled into the corner pocket.	4	4	8	8	1
1542	language	He uttered harsh language.	He recorded the spoken language of the streets.	23	17	31	25	1
1543	raise	A few important questions were raised after the attack.	To raise your walking stick to defend yourself.	3	31	8	37	0
1544	sanitize	Sanitize history.	Sanitize a document before releasing it to the press.	0	0	8	8	1
